{
  "$schema": "https://handbuch.cloud/schema.json",
  "name": "ejs",
  "registry": "npm",
  "updatedAt": "2026-06-06T18:37:42.522Z",
  "checkedAt": "2026-06-06T18:37:42.522Z",
  "readme": "https://raw.githubusercontent.com/mde/ejs/main/README.md",
  "docs": [
    {
      "url": "https://ejs.co/",
      "title": "EJS Documentation",
      "description": "Embedded JavaScript templating language. Official docs cover tags, includes, and options.",
      "kind": "official",
      "tags": [
        "guide",
        "api",
        "reference",
        "templating",
        "official"
      ]
    },
    {
      "url": "https://github.com/mde/ejs",
      "title": "EJS GitHub Repository",
      "description": "Source code and issue tracker.",
      "kind": "official",
      "tags": [
        "guide",
        "api"
      ]
    }
  ]
}
