{
  "$schema": "https://handbuch.cloud/schema.json",
  "name": "argparse",
  "registry": "npm",
  "updatedAt": "2026-06-06T18:37:42.522Z",
  "checkedAt": "2026-06-06T18:37:42.522Z",
  "readme": "https://raw.githubusercontent.com/nodeca/argparse/master/README.md",
  "docs": [
    {
      "url": "https://github.com/nodeca/argparse",
      "title": "argparse Documentation",
      "description": "CLI arguments parser, native port of Python's argparse. README covers subcommands, actions, and help generation.",
      "kind": "official",
      "tags": [
        "guide",
        "api",
        "reference",
        "cli"
      ]
    }
  ]
}
