{
  "$schema": "https://handbuch.cloud/schema.json",
  "name": "connect",
  "registry": "npm",
  "updatedAt": "2026-06-07T11:46:49.000Z",
  "checkedAt": "2026-06-07T11:46:49.000Z",
  "readme": "https://raw.githubusercontent.com/senchalabs/connect/master/README.md",
  "docs": [
    {
      "url": "https://github.com/senchalabs/connect",
      "title": "Connect GitHub Repository",
      "description": "Extensible HTTP server framework for Node.js using middleware plugins. The foundation that Express is built upon. 14M weekly downloads.",
      "kind": "official",
      "tags": [
        "guide",
        "reference"
      ]
    },
    {
      "url": "https://www.npmjs.com/package/connect",
      "title": "Connect npm Package",
      "description": "Usage guide, middleware examples, and API documentation for the Connect middleware framework.",
      "kind": "official",
      "tags": [
        "api",
        "reference"
      ]
    }
  ],
  "tags": [
    "http-server"
  ]
}
