{
  "$schema": "https://handbuch.cloud/schema.json",
  "name": "illuminate/cache",
  "registry": "packagist",
  "updatedAt": "2026-06-06T18:52:33.276Z",
  "checkedAt": "2026-06-06T18:52:33.276Z",
  "readme": "https://raw.githubusercontent.com/illuminate/cache/master/README.md",
  "docs": [
    {
      "url": "https://laravel.com/docs/cache",
      "title": "Laravel Cache Documentation",
      "description": "Official docs for caching drivers, cache tags, atomic locks, and cache management.",
      "kind": "official",
      "tags": [
        "guide",
        "api",
        "reference",
        "cache",
        "performance",
        "official"
      ]
    }
  ],
  "tags": [
    "cache",
    "framework"
  ]
}
