{
  "$schema": "https://handbuch.cloud/schema.json",
  "name": "events",
  "registry": "npm",
  "updatedAt": "2026-06-06T18:37:42.522Z",
  "checkedAt": "2026-06-06T18:37:42.522Z",
  "readme": "https://raw.githubusercontent.com/Gozala/events/master/README.md",
  "docs": [
    {
      "url": "https://github.com/Gozala/events",
      "title": "events Documentation",
      "description": "Node's EventEmitter for all engines. README covers the browser-compatible API.",
      "kind": "official",
      "tags": [
        "guide",
        "api",
        "events",
        "browser"
      ]
    }
  ],
  "tags": [
    "events"
  ]
}
