{
  "$schema": "https://handbuch.cloud/schema.json",
  "name": "moleculer",
  "registry": "npm",
  "updatedAt": "2026-06-07T11:46:49.000Z",
  "checkedAt": "2026-06-07T11:46:49.000Z",
  "readme": "https://raw.githubusercontent.com/moleculerjs/moleculer/master/README.md",
  "docs": [
    {
      "url": "https://moleculer.services/",
      "title": "Moleculer Official Documentation",
      "description": "Progressive microservices framework for Node.js with built-in load balancer, circuit breaker, retries, timeout, and bulkhead features.",
      "kind": "official",
      "tags": [
        "guide",
        "api",
        "reference"
      ]
    },
    {
      "url": "https://moleculer.services/docs/0.14/index.html",
      "title": "Moleculer Getting Started",
      "description": "Core concepts: services, actions, events, mixins, and service discovery for microservice architectures.",
      "kind": "official",
      "tags": [
        "guide",
        "tutorial",
        "beginner"
      ]
    }
  ],
  "tags": [
    "framework",
    "microservices"
  ]
}
