{
  "$schema": "https://handbuch.cloud/schema.json",
  "name": "laravel/scout",
  "registry": "packagist",
  "updatedAt": "2026-06-06T18:52:33.276Z",
  "checkedAt": "2026-06-06T18:52:33.276Z",
  "readme": "https://raw.githubusercontent.com/laravel/scout/master/README.md",
  "docs": [
    {
      "url": "https://laravel.com/docs/scout",
      "title": "Laravel Scout Documentation",
      "description": "Official docs for the driver-based full-text search solution for Eloquent models.",
      "kind": "official",
      "tags": [
        "guide",
        "api",
        "reference",
        "search",
        "eloquent",
        "official"
      ]
    }
  ],
  "tags": [
    "search"
  ]
}
