{
  "$schema": "https://handbuch.cloud/schema.json",
  "name": "eslint",
  "registry": "npm",
  "updatedAt": "2026-06-06T18:37:42.522Z",
  "checkedAt": "2026-06-06T18:37:42.522Z",
  "readme": "https://raw.githubusercontent.com/eslint/eslint/main/README.md",
  "docs": [
    {
      "url": "https://eslint.org/docs/latest/",
      "title": "ESLint Documentation",
      "description": "Official ESLint documentation covering rules, configuration, custom parsers, and the Node.js API.",
      "kind": "official",
      "tags": [
        "guide",
        "api",
        "reference",
        "linting",
        "official"
      ]
    },
    {
      "url": "https://eslint.org/docs/latest/rules/",
      "title": "ESLint Rules Reference",
      "description": "Complete reference for all built-in linting rules with examples.",
      "kind": "official",
      "tags": [
        "reference",
        "rules"
      ]
    },
    {
      "url": "https://eslint.org/docs/latest/extend/plugins",
      "title": "Creating ESLint Plugins",
      "description": "Guide for extending ESLint with custom rules and plugins.",
      "kind": "official",
      "tags": [
        "guide",
        "tutorial",
        "advanced"
      ]
    }
  ]
}
