{
  "$schema": "https://handbuch.cloud/schema.json",
  "name": "laravel/sanctum",
  "registry": "packagist",
  "updatedAt": "2026-06-06T18:52:33.276Z",
  "checkedAt": "2026-06-06T18:52:33.276Z",
  "readme": "https://raw.githubusercontent.com/laravel/sanctum/main/README.md",
  "docs": [
    {
      "url": "https://laravel.com/docs/sanctum",
      "title": "Laravel Sanctum Documentation",
      "description": "Official docs for Laravel's lightweight API authentication system using tokens.",
      "kind": "official",
      "tags": [
        "guide",
        "api",
        "reference",
        "authentication",
        "official"
      ]
    }
  ],
  "tags": [
    "auth"
  ]
}
