{
  "$schema": "https://handbuch.cloud/schema.json",
  "name": "@babel/parser",
  "registry": "npm",
  "updatedAt": "2026-06-06T18:37:42.522Z",
  "checkedAt": "2026-06-06T18:37:42.522Z",
  "docs": [
    {
      "url": "https://babel.dev/docs/en/babel-parser",
      "title": "@babel/parser Documentation",
      "description": "Babel JavaScript parser. Official docs on parsing options, plugins, and output AST.",
      "kind": "official",
      "tags": [
        "guide",
        "api",
        "reference",
        "babel",
        "parser"
      ]
    }
  ],
  "tags": [
    "parser"
  ]
}
