{
  "$schema": "https://handbuch.cloud/schema.json",
  "name": "p-locate",
  "registry": "npm",
  "updatedAt": "2026-06-06T18:37:42.522Z",
  "checkedAt": "2026-06-06T18:37:42.522Z",
  "readme": "https://raw.githubusercontent.com/sindresorhus/p-locate/main/readme.md",
  "docs": [
    {
      "url": "https://github.com/sindresorhus/p-locate",
      "title": "p-locate Documentation",
      "description": "Get the first fulfilled promise satisfying a test function. README covers concurrency and options.",
      "kind": "official",
      "tags": [
        "guide",
        "api",
        "promise"
      ]
    }
  ],
  "tags": [
    "async",
    "cli"
  ]
}
